{
  "$schema": "http://json-schema.org/draft-04/schema#",
  "title": "bundle",
  "description": "A bundle is a collection of STIX Objects grouped together to enable them to be exchanged across interoperable systems.",
  "type": "object",
  "properties": {
	"type": {
	  "type": "string",
	  "description": "The type of this object, which MUST be the literal `bundle`.",
	  "enum": ["bundle"]
	},
	"id": {
	  "$ref": "identifier.json",
	  "description": "An identifier for this bundle."
	},
	"spec_version": {
	   "type": "string",
       "enum": ["2.0"],
	   "description": "The version of the STIX specification used to represent the content in this bundle."
	},
	"attack_patterns": {
	  "type": "array",
	  "description": "Specifies a set of one or more Attack Patterns.",
	  "items": {"$ref": "../sdos/attack-pattern.json"}
	},
	"campaigns": {
	  "type": "array",
	  "description": "Specifies a set of one or more Campaigns.",
	  "items": {"$ref": "../sdos/campaign.json"}
	},
	"courses_of_action": {
	  "type": "array",
	  "description": "Specifies a set of one or more Courses of Action that could be taken in regard to one of more cyber threats.",
	  "items": {"$ref": "../sdos/course-of-action.json"}
	},
    "incidents": {
	  "type": "array",
	  "description": "Specifies a set of one or more cyber threat Incidents.",
	  "items": {"$ref": "../sdos/incident.json"}
	},
	"indicators": {
	  "type": "array",
	  "description": "Specifies a set of one or more cyber threat Indicators.",
	  "items": {"$ref": "../sdos/indicator.json"}
	},
	"infrastructures": {
	  "type": "array",
	  "description": "Specifies a set of one or more cyber threat malicious infrastructure.",
	  "items": {"$ref": "../sdos/infrastructure.json"}
	},
	"intrusion_sets": {
	  "type": "array",
	  "description": "Specifies a set of one or more cyber threat Intrusion Sets.",
	  "items": {"$ref": "../sdos/intrusion-set.json"}
	},
	"malware": {
	  "type": "array",
	  "description": "Specifies a set of one or more Malware TTPs.",
	  "items": {"$ref": "../sdos/malware.json"}
	},
	"marking_definitions": {
	  "type": "array",
	  "description": "Specifies a set of one or more Marking Definitions.",
	  "items": {"$ref": "marking-definition.json"}
	},
	"observed_data": {
	  "type": "array",
	  "description": "Specifies a set of one or more piece of Observed Data.",
	  "items": {"$ref": "../sdos/observed-data.json"}
	},
	"relationships": {
	  "type": "array",
	  "description": "Specifies a set of one or more relationships between SDOs.",
	  "items": {"$ref": "../sros/relationship.json"}
	},
	"reports": {
	  "type": "array",
	  "description": "Specifies a set of one or more reports.",
	  "items": {"$ref": "../sdos/report.json"}
	},
	"sightings": {
	  "type": "array",
	  "description": "Specifies a set of one or more sightings.",
	  "items": {"$ref": "../sros/sighting.json"}
	},
	"sources": {
	  "type": "array",
	  "description": "Specifies a set of one or more individual or organizational sources.",
	  "items": {"$ref": "../sdos/source.json"}
	},
	"threat_actors": {
	  "type": "array",
	  "description": "Specifies a set of one or more Threat Actors.",
	  "items": {"$ref": "../sdos/threat-actor.json"}
	},
    "tools": {
	  "type": "array",
	  "description": "Specifies a set of one or more Tools.",
	  "items": {"$ref": "../sdos/tool.json"}
	},
    "victim_targets": {
	  "type": "array",
	  "description": "Specifies a set of one or more Victim Targets.",
	  "items": {"$ref": "../sdos/victim-target.json"}
	},
    "vulnerabilities": {
	  "type": "array",
	  "description": "Specifies a set of one or more Vulnerabilities.",
	  "items": {"$ref": "../sdos/vulnerability.json"}
	},
    "custom_objects": {
	  "type": "array",
	  "description": "Specifies a list of one or more custom objects.",
	  "items": {
        "type": "object"
      }
	}
  },
  "required": ["type", "id", "spec_version"]
}
