{
  "type": "bundle",
  "id": "bundle--44af6c39-c09b-49c5-9de2-394224b04982",
  "spec_version": "2.0",

  "campaigns": [
    {
        "type": "campaign",
        "id": "campaign--b549a58c-afd9-4847-85c3-5be13d56d3cc",
        "version": 1,
        "created": "2014-09-09T19:58:39.609000Z",
		"modified": "2014-09-09T19:58:39.609000Z",
        "name": "Operation Omega"
    }
  ],

  "indicators": [
    {
        "type": "indicator",
        "id": "indicator--c43a0a05-e8d2-4f64-ae37-3f3fb153f8d9",
        "version": 1,
        "created": "2014-09-09T19:58:39.609000Z",
		"modified": "2014-09-09T19:58:39.609000Z",
        "labels": ["malicious-activity"],
        "pattern": "ipv4addr-object.value EQ '10.0.0.0'",
		"pattern_lang": "cybox",
		"valid_from": "2014-09-09T19:58:39.609000Z"
    }
  ],
  
  "relationships": [
    {
        "type": "relationship",
        "id": "relationship--eca24e47-2259-4850-9705-fd1065c77236",
        "version": 1,
        "relationship_type": "indicates",
        "created": "2014-09-09T19:58:39.609000Z",
		"modified": "2014-09-09T19:58:39.609000Z",
        "source_ref": "indicator--c43a0a05-e8d2-4f64-ae37-3f3fb153f8d9",
        "target_ref": "campaign--b549a58c-afd9-4847-85c3-5be13d56d3cc"        
    }
  ]
}
  
