{
  "type": "bundle",
  "id": "bundle--91d9b5a2-b63b-431b-ab56-aba30ab36809",
  "spec_version": "2.0",
  
  "indicators":[
	{
		"type": "indicator",
		"id": "indicator--f33c2b75-aa60-4ffb-9829-3746ef233311",
		"version": 1,
		"created": "2014-10-21 21:10:09.423000+00:00",
		"modified": "2014-10-21 21:10:09.423000+00:00",
		"valid_from": "2014-10-21 21:10:09.423000+00:00",
		"kill_chain_phases": [
		{
			"kill_chain_name": "LM Cyber Kill Chain",
			"phase_name": "Actions on Objectives"
		}
		]
	}
  ]
}