{
  "type": "bundle",
  "id": "bundle--2b8fb66f-b6b3-4d40-865a-33e4a5ee1246",
  "spec_version": "2.0",
  
  "malware": [
    {
      "type": "malware",
	  "id": "malware--bce53fe4-d5ac-4f0b-9675-d728a60675a2",
	  "version": 1,
	  "created": "2016-08-23T18:05:49.371000",
	  "modified": "2016-08-23T18:05:49.371000",
	  "name": "Poison Ivy Variant v4392-acc",
	  "labels": [
		"remote-access-trojan"
	  ]
    }
  ]
}