{
  "type": "bundle",
  "id": "bundle--50578bc7-bb17-4f31-abf2-d5827d131368",
  "spec_version": "2.0",
  
  "campaigns": [
    {
      "type": "campaign",
      "id": "campaign--1855cb8a-d96c-4859-a450-abb1e7c061f2",
      "version": 1,
      "created": "2015-05-07T14:22:14.760144Z",  
	  "modified": "2015-05-07T14:22:14.760144Z",
      "name": "Campaign against ICS"
    }
  ],
  
  "sources": [
    {
      "type": "source",
      "id": "source--d7ae33db-0111-45e7-9adb-75a7b081859a",
	  "version": 1,
	  "created": "2015-03-02T13:15:18.793213Z",
	  "modified": "2015-03-02T13:15:18.793213Z",
      "name": "Government Sharing Program - GSP",
	  "entity_class": "organization",
	  "sector": "government-national"
    }
  ],
  
  "malware": [
    {
      "type": "malware",
      "id": "malware--66647c79-5766-4ca7-ab8a-a579056e3c83",
      "version": 1,
      "created": "2015-05-07T14:22:14.760302Z",
	  "modified": "2015-05-07T14:22:14.760302Z",
      "name": "DrownedRat",
      "labels": ["remote-access-trojan"] 
    }
  ],
  
  "reports": [
   {
      "type": "report",   
      "id": "report--41e59083-e2d9-4e4b-9095-ebd1eb2f9350",
      "version": 1,
      "created": "2015-05-07T14:22:14.760467Z",
	  "modified": "2015-05-07T14:22:14.760467Z",
      "report_refs": [
		"source--d7ae33db-0111-45e7-9adb-75a7b081859a",
		"campaign--1855cb8a-d96c-4859-a450-abb1e7c061f2"
	  ],
      "name": "Report on Adversary Alpha's Campaign against the Industrial Control Sector",
      "description": "Adversary Alpha has a campaign against the ICS sector!",
      "labels": ["campaign"],
      "published": "2015-01-01T12:42:16.157317Z"      
    },
    
    {
      "type": "report",   
      "id": "report--bd9cdb35-16a3-4b20-927a-3ae97d5ec4b9",
      "version": 1,
      "created": "2015-05-07T14:22:14.760756Z",
	  "modified": "2015-05-07T14:22:14.760756Z",
      "report_refs": [
		"source--d7ae33db-0111-45e7-9adb-75a7b081859a",
		"malware--66647c79-5766-4ca7-ab8a-a579056e3c83"
	  ],
      "name": "Indicators for Malware DrownedRat",
      "description": "Adversary Alpha has a campaign against the ICS sector!",
      "labels": [
		"indicator",
		"malware"
	  ],
	  "published": "2015-01-01T12:42:16.157317Z"      
    }
  ]
}
  