{
  "type": "bundle",
  "id": "bundle--44af6c39-c09b-49c5-9de2-394224b04982",
  "spec_version": "2.0",
  
  "incidents": [
    {
      "type": "incident",
      "id": "incident--d6f8f6d6-e9ea-4d8f-b066-20a492ac9561",
      "version": 1,
      "created": "2014-02-20T09:00:00.000000Z",
	  "modified": "2014-02-20T09:00:00.000000Z",
      "name": "Poison Ivy detection",
      "description":  "Detected Poison Ivy beaconing through perimeter firewalls"	  
    }
  ],
  
  "malware": [
    {
      "type": "malware",
      "id": "malware--1b75ee8f-14d6-819a-d729-09ab52c91fdb",
      "version": 1,
      "created": "2014-02-20T09:00:00.000000Z",
	  "modified": "2014-02-20T09:00:00.000000Z",
      "name": "Poison Ivy",
      "labels": ["remote-access-trojan"] 
    }
  ],
  
  "relationships": [
    {
      "type": "relationship",
      "id": "relationship--da2b5f04-a0f8-4063-9c18-f925c7af94bb",
      "version": 1,
      "created": "2014-02-20T09:00:00.000000Z", 
	  "modified": "2014-02-20T09:00:00.000000Z",
      "name": "related-to",
      "source_ref": "incident--d6f8f6d6-e9ea-4d8f-b066-20a492ac9561",
      "target_ref": "malware--1b75ee8f-14d6-819a-d729-09ab52c91fdb"      
    }  
  ]
}