{
  "type": "bundle",
  "id": "bundle--44af6c39-c09b-49c5-9de2-394224b04982",
  "spec_version": "2.0",

  "attack_patterns": [
    {
        "type": "attack-pattern",
        "id": "attack-pattern--d7b066aa-4091-4276-a142-29d5d81c3484",
        "version": 1,
        "created": "2014-10-31T15:52:13.126765Z",
		"modified": "2014-10-31T15:52:13.126765Z",
        "name": "Phishing",
        "external-references": [
          {
          "source_name": "CAPEC",
          "external_id": "capec-98"
          }
        ]
    }
  ],

  "indicators": [
    {
        "type": "indicator",
        "id": "indicator--8cf9236f-1b96-493d-98be-0c1c1e8b62d7",
        "version": 1,
        "created": "2014-10-31T15:52:13.127931Z",
		"modified": "2014-10-31T15:52:13.127931Z",
        "name": "Malicious Email",		
        "labels": ["malicious-activity"],       
		"valid_from": "2014-10-31T15:52:13.127931Z",
		"pattern": "message-object:extended_properties['email-message'].subject MATCHES \/^\\[IMPORTANT\\] Please Review Before\/ AND message-object:extended_properties['email-message'].attachments[*].name MATCHES \/^Final Report.+\\.exe$\/"
    }
  ],
  
  "relationships": [
       {
         "type": "relationship",
         "id": "relationship--e983dad5-7c88-444a-9f78-cf31dbfae2bd",
         "version": 1,
         "created": "2014-10-31T15:52:13.126765Z",
		 "modified": "2014-10-31T15:52:13.126765Z",
         "name": "indicates",
         "source_ref": "indicator--8cf9236f-1b96-493d-98be-0c1c1e8b62d7",
         "target_ref": "attack-pattern--d7b066aa-4091-4276-a142-29d5d81c3484"         
     }
  ]
}
